user_input,retrieved_contexts,response,reference,faithfulness,answer_relevancy,llm_context_precision_with_reference,context_recall
How does Kafka handle replication?,"['The primary goal of Kafka 0.8 is to add the intra-cluster replication support. Before 0.8, if a broker goes down, the data on that broker is not available until the broker comes back. This is a severe limitation for some applications. By adding replication in 0.8, we increase both the availability and the durability of Kafka. The details of the replication design can be found here \xa0and\xa0 here .\xa0The following are the replication related changes in 0.8: \n \n \n- New administrative tools for creating, listing and deleting topics. \n \n- New zookeeper data structures for storing replica assignments and state information about each partition (e.g., which replica is the leader and which replicas are in-sync with the leader). \n \n- An embedded controller for detecting broker failures and managing the state change of each partition (e.g., moving a partition from offline to online and changing the leader of a partition when the previous leader fails). \n \n- Modified RPC protocol to allow a producer to wait for an ack until a message reaches a certain # of replicas and new RPC requests for clients to get the metadata of each topic (e.g., # of partitions, the leader of each partition), and for the controller to communicate with the broker. \n \n- An async processing framework for handling produce and fetch requests that may not be satisfied immediately. \n \n- A replica manager that manages the set of replicas assigned to a broker. \n \n- A\xa0significant\xa0system test framework for testing various failure scenarios. \n \n- A migration tool for mirroring pre-0.8 data to 0.8. \n \n Because of the significant changes in zookeeper data and the RPC protocol, we decided to make 0.8 a non-backward compatible release. Therefore, we try to combine a few other non-backward compatible changes in this release to make future releases easier. \n \n \n- New RPC protocol for all types of requests. \n \n- A new format of the log that makes the offset of each message logical, instead of physical. \n \n- Standardized config names. \n \n- Exposing all jmx metrics using the metrics core package.', ""0.11.0.0 KIP-124 - Request rate quotas 0.11.0.0 KIP-123: Allow per stream/table timestamp extractor 0.11.0.0 KIP-122: Add Reset Consumer Group Offsets tooling 0.11.0.0 KIP-121: Add KStream peek method 0.11.0.0 KIP-120: Cleanup Kafka Streams builder API 1.0.0 KIP-119: Drop Support for Scala 2.10 in Kafka 0.11 0.11.0.0 KIP-118: Drop Support for Java 7 2.0.0 KIP-117: Add a public AdminClient API for Kafka admin operations 0.11.0.0 KIP-115: Enforce offsets.topic.replication.factor upon __consumer_offsets auto topic creation 0.11.0.0 KIP-114: KTable state stores and improved semantics 0.11.0.0 KIP-113: Support replicas movement between log directories 1.1.0 KIP-112: Handle disk failure for JBOD 1.0.0 2.1.0 KIP-109: Old Consumer Deprecation 0.11.0.0 KIP-108: Create Topic Policy 0.10.2.0 KIP-107: Add deleteRecordsBefore() API in AdminClient 0.11.0.0 KIP-106 - Change Default unclean.leader.election.enabled from True to False 0.11.0.0 KIP-105: Addition of Record Level for Sensors 0.10.2.0 KIP-104: Granular Sensors for Streams \xa0 0.10.2.0 KIP-103: Separation of Internal and External traffic 0.10.2.0 KIP-102 - Add close with timeout for consumers 0.10.2.0 KIP-101 - Alter Replication Protocol to use Leader Epoch rather than High Watermark for Truncation 0.11.0.0 KIP-100 - Relax Type constraints in Kafka Streams API 0.10.2.0 KIP-99: Add Global Tables to Kafka Streams 0.10.2.0 KIP-98 - Exactly Once Delivery and Transactional Messaging 0.11.0.0 KIP-97: Improved Kafka Client RPC Compatibility Policy 0.10.2.0 KIP-96 - Add per partition metrics for in-sync and assigned replica count 0.10.2.0 KIP-94 Session Windows 0.10.2.0 KIP-93: Improve invalid timestamp handling in Kafka Streams 0.10.2.0 KIP-92 - Add per partition lag metrics to KafkaConsumer 0.10.2.0 KIP-91 Provide Intuitive User Timeouts in The Producer 2.1.0 KIP-90 - Remove zkClient dependency from Streams 0.10.2.0 KIP-89: Allow sink connectors to decouple flush and offset commit 0.10.2.0 KIP-88: OffsetFetch Protocol Update 0.10.2.0 KIP-86: Configurable SASL callback handlers 2.0.0 KIP-85: Dynamic JAAS configuration for Kafka clients 0.10.2.0 KIP-84: Support SASL SCRAM mechanisms 0.10.2.0 KIP-82 - Add Record Headers 0.11.0.0 KIP-81: Bound Fetch memory usage in the consumer 2.8.0 (WIP) KIP-79 - ListOffsetRequest/ListOffsetResponse v1 and add timestamp search methods to the new consumer 0.10.1.0 KIP-78: Cluster Id 0.10.1.0 KIP-77: Improve Kafka Streams Join Semantics 0.10.2.0 KIP-75 - Add per-connector Converters 0.10.1.0 KIP-74: Add Fetch Response Size Limit in Bytes 0.10.1.0 KIP-73: Replication Quotas 0.10.1.0 KIP-72: Allow putting a bound on memory consumed by Incoming request \xa0 1.0.0 KIP-71: Enable log compaction and deletion to co-exist 0.10.1.0 KIP-70: Revise Partition Assignment Semantics on New Consumer's Subscription Change 0.10.1.0 KIP-67: Queryable state for Kafka Streams 0.10.1.0 KIP-66: Single Message Transforms for Kafka Connect 0.10.2.0 / 0.11.0.0 KIP-65: Expose timestamps to Connect 0.10.1.0 KIP-63: Unify store and downstream caching in streams 0.10.1.0 KIP-62: Allow consumer to send heartbeats from a background thread 0.10.1.0 KIP-60 - Make Java client classloading more flexible 0.10.1.0 KIP-58 - Make Log Compaction Point Configurable 0.10.1.0 KIP-57 - Interoperable LZ4 Framing 0.10.0.0 KIP-56: Allow cross origin HTTP requests on all HTTP methods 0.10.0.0 KIP-55: Secure Quotas for Authenticated Users 0.10.1.0 KIP-54: Sticky Partition Assignment Strategy 0.11.0.0 KIP-52: Connector Control APIs 0.10.0.0 KIP-51 - List Connectors REST API 0.10.0.0 KIP-48 Delegation token support for Kafka 1.1.0 KIP-45 - Standardize all client sequence interaction on j.u.Collection."", '### A. Overview \n According to Kafka Replication Design document, ""The purpose of adding replication in Kafka is for stronger durability and higher availability. We want to guarantee that any successfully published message will not be lost and can be consumed, even when there are server failures. Such failures can be caused by machine error, program error, or more commonly, software upgrades."" \n- \n#### Design documentation \n \n- https://issues.apache.org/jira/secure/attachment/12487175/kafka_replication_highlevel_design.pdf \n- https://cwiki.apache.org/confluence/display/KAFKA/kafka+Detailed+Replication+Design+V3', '# Kafka Replication High-level Design \n \n The purpose of adding replication in Kafka is for stronger durability and higher availability. We want to guarantee that any successfully published message will not be lost and can be consumed, even when there are server failures. Such failures can be caused by machine error, program error, or more commonly, software upgrades. We have the following high-level goals: \n \n \n- Configurable durability guarantees: For example, an application with critical data can choose stronger durability, with increased write latency, and another application generating a large volume of soft-state data can choose weaker durability but better write response time. \n \n- Automated replica management: We want to simplify the assignment of replicas to broker servers and be able to grow the cluster incrementally. \n \n There are mainly two problems that we need to solve here: \n \n \n- How to assign replicas of a partition to broker servers evenly? \n \n- For a given partition, how to propagate every message to all replicas?', '# About Kafka \n \n Kafka is a distributed publish-subscribe messaging system. \n It is designed to support the following: \n \n \n- Persistent messaging with O(1) disk structures that provide constant time performance even with many TB of stored messages. \n \n- High-throughput: even with very modest hardware Kafka can support hundreds of thousands of messages per second. \n \n- Explicit support for partitioning messages over Kafka servers and distributing consumption over a cluster of consumer machines while maintaining per-partition ordering semantics. \n \n- Support for parallel data load into Hadoop. \n \n Kafka provides a publish-subscribe solution that can handle all activity stream data and processing on a consumer-scale web site. This kind of activity (page views, searches, and other user actions) are a key ingredient in many of the social feature on the modern web. This data is typically handled by ""logging"" and ad hoc log aggregation solutions due to the throughput requirements. This kind of ad hoc solution is a viable solution to providing logging data to an offline analysis system like Hadoop, but is very limiting for building real-time processing. Kafka aims to unify offline and online processing by providing a mechanism for parallel load into Hadoop as well as the ability to partition real-time consumption over a cluster of machines. \n The use for activity stream processing makes Kafka comparable to Facebook\'s Scribe or Cloudera\'s Flume, though the architecture and primitives are very different for these systems and make Kafka more comparable to a traditional messaging system.']","Kafka handles replication by assigning multiple replicas to each partition, which are distributed across different broker servers to ensure high availability and durability. The replication mechanism is designed to guarantee that any successfully published message will not be lost and can be consumed even in the event of server failures, which can occur due to machine errors, program errors, or software upgrades [Source 3].

Kafka's replication system includes an embedded controller that detects broker failures and manages state changes for each partition, such as moving a partition from offline to online and changing the leader of a partition when the previous leader fails [Source 0]. The system also features automated replica management to simplify the assignment of replicas to brokers and support incremental cluster growth [Source 3].

Additionally, Kafka allows configurable durability guarantees, enabling applications to choose between stronger durability with increased write latency or weaker durability with better write response time, depending on their requirements [Source 3].

Sources:
- [Source 0 - Changes in Kafka 0.8]
- [Source 3 - Kafka Replication High-level Design]","Kafka replicates data by maintaining multiple copies of each partition across different brokers. One broker serves as the leader for a partition and handles all reads and writes, while follower brokers replicate the data. Kafka maintains an in-sync replica set (ISR) to track which followers are up to date. If the leader fails, one of the in-sync followers is elected as the new leader.",1.0,0.9640788808154894,0.999999999975,1.0
What is the checkpoint mechanism in Apache Flink?,"['## Checkpoint\xa0 \n In database (take MySQL for example) there’s also a checkpoint\xa0 concept [2]. Along with data ingestion, changes are made to data pages which are cached in the buffer pool and written to the data files some time later by a process known as flushing . The checkpoint is a record of the latest changes that have been successfully flushed. There’re two types of checkpoint: fuzzy [3] and sharp [4], and with InnoDB storage engine, both types will be executed [5]. \n- During normal operation, it performs fuzzy checkpoints, just like the normal checkpointing process in Flink. \n- When the database shuts down, it performs a sharp checkpoint, which is missing\xa0 in current Flink job stopping process. Please note that\xa0checkpoint in both Flink and database are system-controlled process.', '# Motivation \n In many scenarios, we want to finish a job with a savepoint. This can be, for example, because we want to upgrade our cluster, or because we finished processing the important part of our data and we want to simply terminate the job, but make sure that our output is safely stored to our sink storage system, e.g. using the StreamingFileSink . Currently, Flink offers the functionality of cancelling a job with a savepoint. Under the hood, this entails two tasks. These are: \n- take a savepoint, and when the state of the checkpoint is safely stored, \n- cancel the job. When applied to the current exactly-once sinks, this approach is problematic, as it does not guarantee that side-effects will be committed by Flink to the 3rd party storage system. To understand the problem in more detail, see Appendix A below. This document targets fixing the end-to-end semantics when stopping jobs and proposes the addition of two shutting down modes which ensure that no events come after the checkpoint. In the remainder of the document we clarify the semantics of the two shutdown methods and discuss the implementation of the feature.', '# Motivation \n The existing checkpoint algorithm ( Asynchronous Barrier Snapshotting for DAGs) has a very fluid and straightforward protocol. It just makes sure that all checkpoint barriers are aligned in each operator so that all records before barriers (pre-shot) are processed before taking a snapshot. Since waiting indefinitely for all records in-transit within a cycle of an execution graph can violate termination (crucial liveness property) we have to...save any unprocessed records for later and get done with the snapshot.', '` SourceReader ` need to register to ` SourceCoordinator ` ( address is in ` TaskDeploymentDescriptor ` or be updated by ` JobMaster ` through RPC ) and then sends split request with payload information. Each job has at most one ` SourceCoordinator ` which is started by ` JobMaster ` . There might be several ` Enumerators ` in one job since there might be several different sources , all ` Enumerators ` run on this ` SourceCoordinator ` . Split assignment need to satisfy the checkpointing mode semantics. ` Enumerator ` has its own states ( split assignment ), they are a part of global checkpoint. When a new checkpoint is triggered , ` CheckpointCoordinator ` sends barriers to ` SourceCoordinator ` first. ` SourceCoordinator ` snapshots states of all\xa0 ` Enumerators ` . Then ` SourceCoordinator ` sends barriers to ` SourceReader ` through RPC. The split and barrier through RPC is FIFO , so Flink could align the split assignment with checkpoint naturally. If user specifies ` RestartAllStrategy ` as the failover strategy , Flink restarts all tasks and ` SourceCoordinator ` when a task fails. All tasks and ` Enumerators ` are restarted and restored from last successful checkpoint. If user specifies ` RestartPipelinedRegionStrategy ` as failover strategy , it ’ s a little complicated. There is no failover region problem in this model , since there is no execution edge between ` Enumerator ` and ` SourceReader ` ( ` SourceCoordinator ` is not a port of ` ExecutionGraph ` ) . We need to explain it separately. - When a ` SourceReader ` task fails , ` JobMaster ` \xa0does not restart the ` SourceCoordinator ` or the ` Enumerators ` on it. ` JobMaster ` cancels other tasks in the same failover region with failed task as usual. Then ` JobMaster ` notifies ` Enumerator ` the failure or cancelation of ` SourceReader ` tasks ( there might be multiple ` SourceReader ` tasks in same failover region ) and which checkpoint version will be restored from. The notification happens before restarting new tasks. When ` Enumerator ` is aware of the task failures , it restores the states related failed tasks from the specific checkpoint version. That means ` SourceCoordinator ` need to support partial restoring. ` Enumerator ` also keeps a two-level map of ` SourceReader ` , checkpoint version and split assignment in memory. This map helps to find the splits should be reassigned or added back to ` Enumerator ` . There would be different strategies to handle these failed splits.', '# Current Situation \n Currently, Flink\'s UDFs, and more specifically the RichFunction, which exposes methods related to a UDF’s lifecycle, only have a close() method which is called in any case of job termination. This includes any form of orderly termination and termination due to an error. This is insufficient as each of the aforementioned termination contexts requires special handling. For an illustrative example, we can use the StreamingFileSink which guarantees exactly-once end-to-end semantics when writing to the filesystem by ""parking"" data in temporary ""part-files"" between checkpoints, and ""committing"" these files, or making them visible to the outside world, upon successful checkpoint completion. This guarantees that even in the case of failure, the ""committed"" files will never be invalidated, as their input data are part of the last successful checkpoint and thus will not be reprocessed. A job that uses the StreamingFileSink would want the sink to perform the following actions in each of the cases of job termination: \n- FINITE SOURCE: \n- close any in-progress part file and get them ready to be committed, \n- commit them, \n- perform any necessary resource clean-up. ASSUMPTION: The assumption here is that batch does not have checkpointing enabled thus ""re-using"" stop-with-savepoint is not an option. As a fault-tolerance mechanism in batch we assume that the results of shuffles are materialized and stored persistently, and in the case of a failure, the job resume from the last successfully persisted shuffle result. - DRAIN (stop-with-savepoint with max wm): this is equivalent to sending the EOS and taking a final savepoint. So we want to: \n- send the MAX_WATERMARK \n- close any in-progress part file and get them ready to be committed,\xa0 \n- take the savepoint the user requested. This will reflect that there are no in-progress part files as we are draining our pipeline. - let the previously closed in-progress part files be committed as a result of a successful savepoint (as it is done currently). - perform any necessary resource clean-up. - SUSPEND (stop-with-savepoint): this stops the job with a final savepoint without ""draining"" the pipeline, so no EOS or MAX_WATERMARK is sent. In this case we want to:\xa0 \n- \xa0take the savepoint the user requested as usual. - \xa0perform any necessary resource clean-up.']","The checkpoint mechanism in Apache Flink is a system-controlled process that ensures fault tolerance by periodically saving the state of a streaming application. Flink uses an algorithm called Asynchronous Barrier Snapshotting for Directed Acyclic Graphs (DAGs) to implement checkpoints. This algorithm ensures that all checkpoint barriers are aligned in each operator, allowing all records before the barriers to be processed before taking a snapshot [Source 2]. 

Checkpoints in Flink are similar to database checkpoints, where changes are recorded and flushed to ensure data consistency. In Flink, checkpoints are typically fuzzy, meaning they occur during normal operation without stopping the data flow, akin to the fuzzy checkpoints in databases like MySQL [Source 0]. The checkpointing process involves the `CheckpointCoordinator` sending barriers to the `SourceCoordinator`, which then snapshots the states of all enumerators and sends barriers to the `SourceReader` through RPC, ensuring that the split assignment aligns with the checkpoint [Source 3].

Sources:
- [Source 0]
- [Source 2]
- [Source 3]","Flink's checkpoint mechanism periodically snapshots the state of a streaming application to durable storage. It uses the Chandy-Lamport algorithm to create consistent snapshots without stopping the data flow. Checkpoint barriers are injected into the data streams and when all barriers arrive at a task, its state is snapshotted. On failure, Flink restores from the latest completed checkpoint to resume processing with exactly-once semantics.",0.8571428571428571,0.9657432544383019,0.6791666666496875,0.75
How do you schedule a DAG in Apache Airflow?,"[""## Proposal \n Note. In this AIP we refer “asset” as a dataset in Airflow 2.10. We use “asset” because “dataset” is renamed “asset” in AIP 73. Today in Airflow, you can build event-based workflows using either external task sensor, sensors/deferrable operators, REST API, and dataset (to be renamed as Assets). Scheduling using assets has recently gained popularity given the efficient execution, monitoring support and API capabilities. An Airflow asset is a logical grouping of data. Upstream producer tasks can update assets, and asset updates contribute to scheduling downstream consumer DAGs. Example: In this example, the first DAG sends an event (or updates) the asset, and the second DAG is scheduled upon asset update. However, as illustrated in the example above, updating the asset is the user's responsibility. In the example above the user uses a DAG but other techniques such as using the “Create dataset event” Rest API are available to the user to update an asset. All these techniques are great but require some work from the user to set-up a pipeline in order to update the asset. Ideally, there should be an end to end solution in Airflow to trigger DAGs based on external event such as: \n- A message has been pushed in a message queue such as Google Pubsub, Amazon SQS, Azure Message Bus, Apache Kafka, ... \n- A file has been created in a storage service \n- A database has been updated"", '## Functional scope:\xa0 \n We have effectively finalized the scope of Airflow 2.0 and now actively workings towards merging all the code and getting it released. The big functional elements are listed below: \n- Scheduler HA - Improve Scheduler performance and reliability ( AIP-15 ) \n- Airflow REST API ( AIP-32 ) \n- Functional DAGs ( AIP-31 ) \n- Production-ready Docker Image ( AIP-26 ) \n- Providers Package ( AIP-21 ) \n- Simplified Kubernetes Executor and KubePodOperator \n- Smart Sensor PR ( AIP-17 ) as an ""early access"" feature. - Improvements to SubDAGs ( AIP-34 ): Task Groups as an alternative to SubDAGs and a future replacement The following functional elements were discussed and deferred to a later (post 2.0) release: \n- DAG Versioning \n- Schedule Interval / Execution at Start of Schedule or End of Schedule \n- Production-ready Helm Chart (part of AIP-26) The current status of the above in-scope items with respect to code needed to be merged into master: Scheduler HA (AIP-15) Merged. REST API (AIP-32) Merged. Functional DAGs (AIP-31) Merged. Providers Package (AIP-21) Merged. Being released independently as intended. Simplified Kubernetes Executor and KubePodOperator Merged Smart Sensors (AIP-17) Merged Task Groups - Improvements to SubDAGs (AIP-34) Merged The major upcoming milestones are detailed below. As stated above, please note that these are statements of intent, rather than absolute. Date Milestone Week of 7 Sep 2020 Create the 2.0.0-test branch - Done. While the scope is fluid, we would be rebasing this test branch from master. After we completely freeze the scope, we would only cherrypick commits from Airflow Master to v2-0-test branch if they are “in-scope”. Normal development would continue on Master branch i.e. PRs would be created against Airflow Master. Week of 12 Oct 2020 First Airflow 2.0 alpha release ""apache-airflow-2.0.0.a1"" cut on Oct 13th.', 'There seems to be a bit of mysticism around the scheduler in Airflow, that makes people reluctant to review PRs in this area or contribute. That should not be the case. The scheduler is the core of Airflow it needs to be the most understood and readable bit of code. So here is a small write up to get you started. A DAG consists of Tasks and obviously you need those tasks to run. To do that we schedule the dag in ""schedule_dag"" (jobs.py) to make it into a DagRun. This means that a DagRun is an instantiation of a DAG in time. Then we need to process the tasks (process_dag in jobs.py) of the current active dagruns. We simply loop over the available tasks and see if they are runnable (if ti.is_runnable()) . If a task is runnable it will get sent to the executor. That\'s all there is to the basic concept. Really? Yes: Now it is a bit more messy at the moment. That is due to the fact that DagRuns are not yet first class citizens. In the past Airflow only had a notion of DagRun: it mentioned them in the code but they did not really exist, instead DAGs were instantiated into ""Tasks in Time"": TaskInstances. This creates architectural issues but also real life ones. Some of the issues in the current scheduler with ""depend_on_past"" stem from this, because a Task is not really able to answer ""which task instance is the first in time?"". It is also the reason why scheduler loops start to increase over time if DAGs get more complex (many tasks). The good news is work is underway to improve this (see the roadmap).', ""# Details \n \n- We do support more than one DAG definition per python file, but it is not recommended as we would like better isolation between DAGs from a fault and deployment perspective and multiple DAGs in the same file goes against that. For now, make sure that the dag object is in the global namespace : you can use the globals dict as in\xa0 ` globals()[dag_id] = DAG(...) ` \n- Configuring parallelism in airflow.cfg \n- parallelism = number of physical python processes the scheduler can run \n- dag_concurrency = the number of TIs to be allowed to run PER-dag at once \n- max_active_runs_per_dag = number of dag runs (per-DAG) to allow running at once \n- Understanding the\xa0 ` execution date ` \n- Airflow was developed as a solution for ETL needs. In the ETL world, you typically summarize data. So, if I want to summarize data for\xa0 ` 2016-02-19 ` , I would do it at\xa0 ` 2016-02-20 midnight GMT ` , which would be right after all data for\xa0 ` 2016-02-19 ` \xa0becomes available. - This date is available to you in both Jinja and a Python callable's context in many forms as documented\xa0 here . As a note\xa0 ` ds ` \xa0refers to\xa0 ` date_string ` , not\xa0 ` date start ` \xa0as may be confusing to some. - Run your entire Airflow infrastructure in UTC. Airflow was developed at Airbnb, where every system runs on UTC (GMT). As a result, various parts of Airflow assume that the system (and database) timezone is UTC (GMT). This includes: \n- Webserver \n- Metadata DB \n- Scheduler \n- Workers (possibly) \n- When setting a schedule, align the start date with the schedule. If a schedule is to run at 2am UTC, the start-date should also be at 2am UTC \n- Bash Operator - Jinja templating and the bash commands \n- Described\xa0 here \xa0: see below. You need to add a space after the script name in cases where you are directly calling a bash scripts in the\xa0 ` bash_command ` \xa0attribute of ` BashOperator ` \xa0- this is because the Airflow tries to apply a Jinja template to it, which will fail."", '## Motivation \n Airflow scheduler uses DAG definitions to monitor the state of tasks in the metadata database, and triggers the task instances whose dependencies have been met. It is based on state of dependencies scheduling.\xa0 However, the current design has the following caveats: \n- When the workflow contains streaming jobs, the scheduler can’t work because the streaming job runs forever. \n- The communication between the operator and scheduler has a long latency of the database query interval. In order to address the issues, we propose to add signal based scheduling to the scheduler. The idea of signal based scheduling is to let the operators send signals to the scheduler to trigger a scheduling action, such as starting jobs, stopping jobs and restarting jobs. With this change, a streaming job can send signals to the scheduler to indicate the state change of the dependencies. This way, the workflow could support a mix of streaming and batch jobs.\xa0 Also, compared with the current state change retrieval mechanism, signal based scheduling allows the scheduler to know the change of the dependency state immediately without periodically querying the metadata database. In addition to that, signal based scheduling allows potential support for richer scheduling semantics such as periodic execution and manual trigger at per operator granularity.']","In Apache Airflow, scheduling a DAG involves defining the DAG and its tasks, and then allowing the Airflow scheduler to manage the execution based on the specified schedule. A DAG (Directed Acyclic Graph) consists of tasks that are scheduled to run at specified intervals. The scheduler converts the DAG into a DagRun, which is an instantiation of the DAG at a specific point in time [Source 2]. The tasks within the DAG are then processed to determine if they are runnable, and if so, they are sent to the executor for execution [Source 2].

Airflow supports various scheduling mechanisms, including time-based scheduling and event-driven scheduling. Time-based scheduling is defined using cron expressions or timedelta objects to specify when the DAG should run. Event-driven scheduling can be achieved using external task sensors, deferrable operators, REST API calls, or by using assets (formerly known as datasets) to trigger DAGs based on external events such as message queue updates or file creations [Source 0].

Additionally, Airflow is exploring signal-based scheduling, which allows operators to send signals to the scheduler to trigger actions like starting or stopping jobs, providing immediate feedback on dependency state changes without relying on periodic database queries [Source 4].

Sources:
- [Source 0]
- [Source 2]
- [Source 4]","In Airflow, DAGs are scheduled using the schedule_interval parameter which accepts cron expressions or timedelta objects. The scheduler continuously monitors DAGs and triggers new runs based on the defined schedule. Each DAG run represents a logical execution for a specific data interval. DAGs can also be triggered manually or via the API.",,0.973834894021384,0.249999999975,0.0
How does Kafka guarantee message ordering?,"[""Actually this implementation isn't very different from what zookeeper itself is, except that it supports partitioning and would scale with the size of the kafka cluster. A number of questions remain: \n \n \n- How do we partition data in this topic? - What is the format of these messages? - How do we ensure the atomicity of updates? - Which brokers can handle an offset update or fetch? I propose that we partition the commit log topic by consumer group to make to give a total order to commits within a single group (as they would all be in the same partition). Downsides to this partitioning would be that the all traffic from a given group would go through a single server and if some groups committed much more than others load might balance poorly. It would be possible to either store all offsets sent in a commit request in a single message or to have one offset per message. The problem with having multiple messages is that it breaks our atomicity requirement if the server loses mastership in the middle of such a write. This is a rare case, but should be dealt with. Grouping offsets together guarantees the atomicity of updates but raises the question of what key is being used for deduplicating updates. Since a consumer would generally send a single commit for all its partitions, but the partition assignment could change, it is hard to think of a key that would result in retaining the complete set of offsets for the consumer group. I propose we use one message per offset and I will outline a scheme for making this fully transactional below. I would propose that any broker can handle an offset request to make life easy for the client. If the broker happens to be the broker that is the master for the log for the consumer group doing the commit it can just apply the change locally, if not it would invoke a commit request to the appropriate server that is currently the leader for the correct partition. A simple client can just direct their requests anywhere; a client that optimizes a bit can try to hit the right server and save themselves the extra hop. Some Nuances \n All replicas will keep the in-memory lookup structure for offsets. This could just be a simple hashmap. This will contain only committed offsets to ensure we never need to undo updates. The offset request will never receive a response until the the offset messages are fully committed to the log, and an unsuccessful commit must not result in updates to the hashmap. Let's deal with some of the nuances of ensuring this kind of atomicity."", '## Introduction \n Kafka provides ""at least once"" delivery semantics. This means that a message that is sent may delivered one or more times. What people really want is ""exactly once"" semantics whereby duplicate messages are not delivered. There are two common reasons duplicate messages may occur: \n- If a client attempts to send a message to the cluster and gets a network error then retrying will potentially lead to duplicates. If network error occurred before the message was delivered, no duplication will occur. However if the network error occurs after the message is appended to the log but before the response can be delivered to the sender the sender is left not knowing what has happened. The only choices are to retry and risk duplication or to give up and declare the message lost. - If a consumer reads a message from a topic and then crashes then when the consumer restarts or another instances takes over consumption the new consumer will start from the last known position of the original consumer. The second case can be handled by consumers by making use of the offset Kafka provides. They can store the offset with their output and then ensure that the new consumer always picks up from the last stored offset. Or, they can use the offset as a kind of key and use it to deduplicate their output in whatever final destination system they populate. The first case currently has no good solution, however. The client doesn\'t know the offset of the message so it has no unique way to identify the message and check if the send succeeded. For consumers that correctly handle duplicates, this proposal would strengthen the guarantees provided by Kafka to what is often called ""atomic broadcast"" . This proposal will introduce an optional set of ids that will provide a unique identifier for messages to avoid duplicates. Some Nuances Opt-in Producer implementations that don\'t care about idempotency should not need to do anything special. Transitivity: Consumers that also produce Consider a more elaborate use case which involves copying data from a source to a Kafka topic. This would be the case with Mirror Maker, for example, or any ""stream processing"" use case. We want it to be the case that the process doing the population can periodically save its position in the upstream topic/database and always resume from this saved position. In the event of a crash we want the copy process to be able to resume from the last known position without producing duplicates in the destination topic. To accomplish this the copy process can save BOTH its input offset/position AND the ids we will introduce associated with its downstream topic.', '# About Kafka \n \n Kafka is a distributed publish-subscribe messaging system. \n It is designed to support the following: \n \n \n- Persistent messaging with O(1) disk structures that provide constant time performance even with many TB of stored messages. \n \n- High-throughput: even with very modest hardware Kafka can support hundreds of thousands of messages per second. \n \n- Explicit support for partitioning messages over Kafka servers and distributing consumption over a cluster of consumer machines while maintaining per-partition ordering semantics. \n \n- Support for parallel data load into Hadoop. \n \n Kafka provides a publish-subscribe solution that can handle all activity stream data and processing on a consumer-scale web site. This kind of activity (page views, searches, and other user actions) are a key ingredient in many of the social feature on the modern web. This data is typically handled by ""logging"" and ad hoc log aggregation solutions due to the throughput requirements. This kind of ad hoc solution is a viable solution to providing logging data to an offline analysis system like Hadoop, but is very limiting for building real-time processing. Kafka aims to unify offline and online processing by providing a mechanism for parallel load into Hadoop as well as the ability to partition real-time consumption over a cluster of machines. \n The use for activity stream processing makes Kafka comparable to Facebook\'s Scribe or Cloudera\'s Flume, though the architecture and primitives are very different for these systems and make Kafka more comparable to a traditional messaging system.', '## Motivation \n \n As a system Kafka has a fairly simple description of correctness: all messages sent to a topic should be delivered to each consumer group consuming that topic. The goal of this facility is to continuously monitor that this is\xa0occurring. A facility similar to this exists at LinkedIn.', 'Because Kafka already provides offset storage for consumers, the need for a new storage system for offset data warrants further discussion. Kafka Connect extends the idea of offsets to a more general form, allowing partition IDs and offsets for source connectors to have arbitrary structure. These cannot easily be mapped directly to the topic-partition offsets that Kafka provides for consumers, even with the recent addition of metadata that can be attached to each of the offsets. Therefore, at least for source connectors, another more general mechanism will be necessary. However, sink tasks may commonly be able to use Kafka’s existing offset commit, and will not need to consider offsets at all since this process can be managed by the Kafka Connect framework. #### Delivery Guarantees \n Kafka Connect can support three different levels of delivery guarantees between a source and sink system: at least once, at most once, and exactly once. Each of these require certain set of functionality for the input and output systems. At least once : each messages is delivered to the output system at least one time, but possibly multiple time. This requires the output system to support a flush operation, which is followed by offset commit in the input system. For Kafka Connect sources, KafkaProducer is the output and already supports flush, and the Kafka Connect framework provides storage and offset commit for the general form offsets generated from the source system. For sinks, the task is the sink and must implement a flush method, and the source is the KafkaConsumer and already supports offset commit stored in Kafka. At most once : each message is delivered to the output system at most once, but may not be delivered at all. This requires buffering of records in the framework so that offsets can be committed in the input system (where the offsets may not be available until the data is read) and then records are sent to the output system. Offset commit is provided by the same components as described in the at least once section. Exactly once : each message is guaranteed to be delivered to (or stored in) the output system exactly once. The implementation will depend on the output system, requiring either idempotency or that input system offsets are tracked in the output system. For source connectors, the output system is Kafka and should be able to achieve exactly once semantics with the idempotent producer ; for sink connectors, it can be achieved in a system-specific way, e.g. using <topic>-<partition>-<offset> as a document ID in a document store like Elasticsearch or atomically committing data & offset using a file rename in HDFS.']","Kafka guarantees message ordering by maintaining per-partition ordering semantics. This means that within a single partition, messages are stored and consumed in the order they were produced. Kafka's architecture explicitly supports partitioning messages over Kafka servers, which allows for distributing consumption across a cluster of consumer machines while ensuring that the order of messages within each partition is preserved [Source 2]. This design ensures that consumers reading from a specific partition will receive messages in the exact order they were produced, thus maintaining message ordering within that partition. 

Sources:
- [Source 2]","Kafka guarantees message ordering within a single partition. Messages sent to the same partition are appended in order and consumers read them in the same order they were written. To ensure ordering for related messages, producers use a partition key so all related messages go to the same partition. Kafka does not guarantee ordering across different partitions.",1.0,1.0000000000000002,0.7555555555303703,1.0
What is a Flink savepoint and how does it differ from a checkpoint?,"['# Motivation \n Currently, Flink managed user keyed state is serialized with different binary formats across different state backends. The inconsistency exists as the following, for both checkpoints and savepoints: \n- Different ways of writing metadata to facilitate iterating through serialized state entries across key groups on restore. \n- Keys and values of the keyed state entries (e.g. ` ValueState ` , ` ListState ` , ` MapState ` , etc.) also have different binary formats in snapshots. The differences mainly root from the fact that different state backends maintain working state differently, and consequently\xa0have specialized formats that allows them to introduce as less overhead as possible when taking a snapshot of the working state as well as restoring from the serialized form. While for checkpoints it is completely reasonable to have state backend specific formats for more efficient snapshots and restores, savepoints should be designed with interoperability in mind and allow for operational flexibilities such as swapping state backends across restores. Moreover, with the current status of state backend code, state backends are responsible of defining what format they write with. This adds overhead to developing new state backends in the future, as well as the possibility that yet another incompatible format is introduced, making the unification even harder to achieve. So, the main goal of this proposal is the following: \n- Unify across all state backends a savepoint format for keyed state that is more future-proof and applicable for potential new state backends.\xa0Checkpoint formats, by definition, are still allowed to be backend specific. \n- Rework abstractions related to snapshots and restoring, to reduce the overhead and code duplication when attempting to implement a new state backend.', '# Introduction \n Although savepoints and checkpoints were created with different semantics and assumptions in mind, some features added along the way blurred the lines and made these assumptions not hold in all scenarios, with potential caveats for users. In addition, some of the semantics of the two features were not clearly defined, with negative consequences for the user. This proposal:\xa0 \n- discusses the relationship between checkpoints and savepoints,\xa0 \n- tries to fix their semantics under a unified perspective based on which both checkpoints and savepoints can be seen as state snapshots, and \n- based on the above, it proposes some additions that aim at reducing the risk of users shooting themselves in the foot.', '## Checkpoint\xa0 \n In database (take MySQL for example) there’s also a checkpoint\xa0 concept [2]. Along with data ingestion, changes are made to data pages which are cached in the buffer pool and written to the data files some time later by a process known as flushing . The checkpoint is a record of the latest changes that have been successfully flushed. There’re two types of checkpoint: fuzzy [3] and sharp [4], and with InnoDB storage engine, both types will be executed [5]. \n- During normal operation, it performs fuzzy checkpoints, just like the normal checkpointing process in Flink. \n- When the database shuts down, it performs a sharp checkpoint, which is missing\xa0 in current Flink job stopping process. Please note that\xa0checkpoint in both Flink and database are system-controlled process.', '# Motivation \n Currently checkpoints and savepoints are handled in slightly different ways with respect to storing and restoring them. The main differences are that savepoints 1) are manually triggered, 2) persist checkpoint meta data, and 3) are not automatically discarded. With this FLIP, I propose to allow to unify checkpoints and savepoints by allowing savepoints to be triggered automatically.', '# Abstraction \n To understand how to best interact with savepoints in a batch context it is important to have a clear mental model of how the data in Flink state relates to a traditional relational database. A database can be thought of as one or more namespaces, each containing a collection of tables. Those tables in turn contain columns whose values have some intrinsic relationship between them, such as being scoped under the same key. A savepoint represents the state of a Flink job at a particular point in time which is made up of many operators. Those operators contain various kinds of state, both partitioned or keyed state, and non-partitioned or operator state. This job contains multiple operators along with various kinds of state. When analyzing that state we can first scope data by its operator, named by setting its uid. Within each operator we can look at the registered states. CurrencyConverter has a broadcast state, which is a type of non-partitioned operator state. In general, there is no relationship between any two elements in an operator state and so we can look at each value as being its own row. Contrast this with Summarize , which contains two keyed states. Because both states are scoped under the same key we can safely assume there exists some relationship between the two values. Therefore, keyed state is best understood as a single table per operator containing one “key” column along with n value columns, one for each registered state. All of this means that the state for this job could be described using the following pseudo-sql commands. In general, the savepoint ↔ database relationship can be summarized as: \n- A savepoint is a database \n- An operator is a namespace named by its uid \n- Each operator state represents a single table \n- Each element in an operator state represents a single row in that table \n- Each operator containing keyed state has a single “keyed_state” table \n- Each keyed_state table has one key column mapping the key value of the operator \n- Each registered state represents a single column in the table \n- Each row in the table maps to a single key Database \n- Namespace1 \n- Column1 \n- Column2 \n- TableA \n- TableB \n- Namespace2 \n- TableA \n- TableB Savepoint \n- Uid1 \n- Value \n- Value \n- Key \n- Column1 \n- Column2 \n- Operator_state_1 \n- Operator_state_2 \n- Keyed_state']","A Flink savepoint is a state snapshot of a Flink job at a particular point in time, which is manually triggered and persists checkpoint metadata. It is designed to be retained indefinitely unless explicitly deleted by the user, allowing for operational flexibility such as swapping state backends across restores [Source 3]. Savepoints are intended to be interoperable and future-proof, facilitating the migration of state between different state backends [Source 0].

In contrast, a checkpoint is a system-controlled process that is automatically triggered and typically discarded after a certain period or upon job completion. Checkpoints are optimized for performance and efficiency during normal operation, allowing for quick recovery from failures [Source 2]. While both savepoints and checkpoints are state snapshots, savepoints are more suited for long-term state management and operational tasks, whereas checkpoints are primarily for fault tolerance during job execution [Source 1].

Sources:
- [Source 0 - FLIP-41: Unify Binary format for Keyed State]
- [Source 1 - FLIP-47: Checkpoints vs. Savepoints]
- [Source 2 - FLIP-45: Reinforce Job Stop Semantic]
- [Source 3 - FLIP-10: Unify Checkpoints and Savepoints]","A savepoint is a manually triggered, portable snapshot of a Flink job's complete state. Unlike checkpoints which are automatic and managed by Flink for fault tolerance, savepoints are user-initiated and designed for operational purposes like upgrading a job, changing parallelism, or migrating between clusters. Savepoints are not automatically cleaned up and must be explicitly managed by the user.",0.8666666666666667,0.9769617573805762,0.8874999999778125,1.0
